{
  "schema_version": "1.0",
  "run_id": "run-00000000000000000000000000000001",
  "engine_version": "0.0.0",
  "verdict": "VERIFIED_FOR_CASES",
  "display_label": "Verified for the selected cases",
  "decision_rule": "V-09",
  "execution_started": true,
  "run_termination": "normal",
  "reason_codes": [
    "ALL_CONDITIONS_SATISFIED"
  ],
  "details": [],
  "flags": {
    "incomplete_checks": false,
    "candidate_violation": false,
    "functional_regression": false,
    "harness_drift": false,
    "flaky_observations": false,
    "baseline_not_reproduced": false,
    "baseline_control_failed": false
  },
  "preconditions": {
    "authorization": "PASSED",
    "pack_integrity": "PASSED",
    "source_identity": "PASSED",
    "environment_identity": "PASSED",
    "result_provenance": "PASSED"
  },
  "counts": {
    "security_tests": 2,
    "functional_tests": 1,
    "pairs_planned": 1,
    "pairs_terminated_normally": 1,
    "pairs_with_trusted_evidence": 1,
    "required_cells": 6,
    "trusted_cells": 6
  },
  "evaluated_at": "2026-10-11T12:00:00Z"
}
